{
  "$schema": "https://json-schema.org/draft/2020-12/schema",
  "$id": "https://probity.dev/schemas/pre-envelope.schema.json",
  "title": "Probity Record Envelope (PRE) for probity-json:v1",
  "type": "object",
  "additionalProperties": false,
  "required": [
    "record_id",
    "spec_version",
    "encoding_id",
    "schema_version",
    "canonical_serialization_id",
    "created_at",
    "evidence_quality",
    "integrity"
  ],
  "properties": {
    "record_id": { "type": "string", "minLength": 1 },

    "spec_version": {
      "type": "string",
      "const": "probity-v1"
    },

    "encoding_id": {
      "type": "string",
      "const": "probity-json:v1"
    },

    "schema_version": {
      "type": "string",
      "minLength": 1,
      "description": "Snapshot schema identifier (e.g., decision-snapshot:v1)."
    },

    "canonical_serialization_id": {
      "type": "string",
      "const": "jcs:rfc8785"
    },

    "created_at": { "$ref": "#/$defs/timestamp" },

    "evidence_quality": {
    "$ref": "https://probity.dev/schemas/enums/evidence-quality.json"
    },

    "integrity": {
      "allOf": [
        { "$ref": "https://probity.dev/schemas/integrity-ref.schema.json" },
        {
          "type": "object",
          "required": ["canonical_serialization_id"],
          "properties": {
            "canonical_serialization_id": { "const": "jcs:rfc8785" }
          }
        }
      ]
    },

    "signature": { "$ref": "https://probity.dev/schemas/signature-object.schema.json" },

    "snapshot": { "$ref": "https://probity.dev/schemas/decision-snapshot.schema.json" },

    "snapshot_ref": {
      "type": "object",
      "additionalProperties": false,
      "required": ["uri", "content_hash"],
      "properties": {
        "uri": { "type": "string", "minLength": 1 },
        "content_hash": { "$ref": "https://probity.dev/schemas/integrity-ref.schema.json" },
        "content_type": { "type": "string", "minLength": 1 },
        "size_bytes": { "type": "integer", "minimum": 0 }
      }
    },

    "extensions": { "$ref": "#/$defs/extensions" }
  },

    "oneOf": [
    {
        "required": ["snapshot"],
        "properties": {
        "snapshot_ref": false
        }
    },
    {
        "required": ["snapshot_ref"],
        "properties": {
        "snapshot": false
        }
    }
    ],

  "$defs": {
    "timestamp": {
      "type": "string",
      "pattern": "^\\d{4}-\\d{2}-\\d{2}T\\d{2}:\\d{2}:\\d{2}(?:\\.\\d{1,9})?Z$"
    },
    "extensions": {
      "type": "object",
      "propertyNames": { "pattern": "^[A-Za-z0-9_]+(\\.[A-Za-z0-9_]+)+$" },
      "additionalProperties": true
    }
  }
}